{
  "case_version": "1.0",
  "case_id": "knowledge_same_identity_different_artifact",
  "contract_id": "knowledge_admission.v1",
  "prior_state": {
    "logical_knowledge_id": "knowledge-manual-summary-001",
    "artifact_digest": "sha256:1111111111111111111111111111111111111111111111111111111111111111"
  },
  "request": {
    "logical_knowledge_id": "knowledge-manual-summary-001",
    "artifact_digest": "sha256:2222222222222222222222222222222222222222222222222222222222222222"
  },
  "expected": {
    "terminal_status": "rejected",
    "mutation_allowed": false,
    "reason_code": "logical_identity_conflict"
  }
}
